post_content,post_type,post_date,ID,seen
من صَلُحَتْ صلاته صلح سائر عمله وفاز فوزا عظيما بصدق قول النبي – صلى الله عليه وسلم – من حديث أبي هريرة – رضي الله عنه - ) إِنَّ أَوَّلَ مَا يُحَاسَبُ بِهِ الْعَبْدُ يَوْمَ الْقِيَامَةِ مِنْ عَمَلِهِ صَلَاتُهُ فَإِنْ صَلُحَتْ فَقَدْ أَفْلَحَ وَأَنْجَحَ وَإِنْ فَسَدَتْ فَقَدْ خَابَ وَخَسِرَ) صحيح,post,2014-11-08 18:38:53,6,
أطل في الصلاة منفردا ولا تطل إن كنت إماما فهو أقرب للإخلاص وصلاة الفرد والنافلة أرجى للخشوع,post,2014-11-08 18:48:01,7,
إحفظ أذكار الصلاة المأثورة عن النبي – صلى الله عليه وسلم – بأنواعها ورددها لتعيش مع الصلاة وتصلّي كما صلّى,post,2014-11-08 18:48:01,8,
إذا لم تسع في زيادة خشوعك فسيهاجم الشيطان خشوعك الحالي ليقل ويتضاءل لتتحول صلاتك إلى عبء ثقيل ثم تكسل وتؤخر وقتها والحل أن تعلو لكيلا تهبط وتزيد لكيلا تنقص وتتطلع إلى مقام أعلى وأخشع,post,2014-11-08 18:48:01,9,
إعلم أن هناك أوقات يكون قلبك أكثر استعدادا وقبولا وأطهر روحا فالتمس تلك الأوقات واعط قلبك حظه من الصلاة فيها,post,2014-11-08 18:48:01,10,
التنوع أساس لأن التكرار أول طريق الملل والسهو والغفلة فغيّر أذكار الصلاة وتفكّر في معانيها ولا تُكرر نفس الأذكار في كل صلواتك,post,2014-11-08 18:48:01,11,
الخشوع تذلل القلوب لعلام الغيوب والقلب أمير البدن فإذا خشع القلب خشع السمع والبصر والوجه وسائر الأعضاء وما نشأ عنها حتى الكلام,post,2014-11-08 18:48:01,12,
الخشوع من الإيمان والإيمان يزيد وينقص والخشوع يزيد وينقص وبقدر عملك الصالح في يوم يكون خشوعك,post,2014-11-08 18:48:01,13,
الخشوع يقظة حتى لا يلتفت القلب وهو من أنفع العلوم وأجلّها لذا كان النبي – صلى الله عليه وسلم - يستعيذ من قلب لا يخشع لأن القلب الذي لا يخشع علمه لا ينفع ودعاؤه لا يسمع,post,2014-11-08 18:48:01,14,
تربي نفسك على المسئولية الفردية والمحاسبة الفردية والتهيؤ للوقوف بين يدي الله سبحانه وتعالى يوم القيامة كما وقفت بين يديه في الصلاة في الدنيا,post,2014-11-08 18:48:01,15,
جوف الليل أخشع وأحب للرب وأقرب للرحمة وأبعد عن الأشغال وأدنى للإخلاص ويستقبل الله فيه كلام من أحبّه وناجاه,post,2014-11-08 18:48:01,16,
سر الصلاة وروحها ولُبّها هو إقبالك على الله بكل ذرة من كيانك ولا ينبغي أن تصرف قلبك عن ربك إلى غيره في الصلاة,post,2014-11-08 18:48:01,17,
فالكوب الممتلئ لا يقبل المزيد إلا إذا فرّغته والقلب لا تدخله معاني الصلاة إلا إذا فرغته من هموم الدنيا,post,2014-11-08 18:48:01,18,
فليست الصلاة حركات تستغرق ساعة من اليوم وينقضي الأمر وتنسى معاني الصلاة لكنها حركة تصحيح وثورة تغيير تستهدف تعديل مسار الحياة لتعيد صياغتها على عين الله,post,2014-11-08 18:48:01,19,
قال الإمام أحمد بن حنبل ' إنما قدرهم من الإسلام على قدر حظهم من الصلاة ورغبتهم في الإسلام على قدر رغبتهم في الصلاة فاعرف نفسك واحذر أن تلقى الله ولا قدر للإسلام عندك فإن قدر الإسلام في قلبك كقدر الصلاة في قلبك     ',post,2014-11-08 18:48:01,20,
قلما تجتمع الجودة مع السرعة فأعط الصلاة حقها ولا تستعجل في آدائها ولا تسرق منها فإنما تسرق من خشوعك وإيمانك,post,2014-11-08 18:48:01,21,
قم إلى الصلاة متى سمعت النداء وبكّر إليها لتطرد هم الدنيا واعلم أن خشوعك سيكون مكافأتك,post,2014-11-08 18:48:01,22,
لا تقرأ بسرعة وتنسى بل اقرأ القليل وتشرّب معانيه واعمل به تصل إلى الكثير بإذن الله,post,2014-11-08 18:48:01,23,
لا تنشغل في صلاتك بدنياك واقض حاجتك قبل دخولك في الصلاة لتصلي بقلب فارغ خاشغ,post,2014-11-08 18:48:01,24,
من صَلُحَتْ صلاته صلح سائر عمله وفاز فوزا عظيما بصدق قول النبي – صلى الله عليه وسلم – من حديث أبي هريرة – رضي الله عنه - ) إِنَّ أَوَّلَ مَا يُحَاسَبُ بِهِ الْعَبْدُ يَوْمَ الْقِيَامَةِ مِنْ عَمَلِهِ صَلَاتُهُ فَإِنْ صَلُحَتْ فَقَدْ أَفْلَحَ وَأَنْجَحَ وَإِنْ فَسَدَتْ فَقَدْ خَابَ وَخَسِرَ) صحيح,post,2014-11-08 18:48:01,25,
هل ذقت يوما طعم قول حبيبك – صلى الله عليه وسلم – ' وَجُعِلَتْ قُرَّةُ عَيْنِي فِي الصَّلاةِ     ',post,2014-11-08 18:48:01,26,
اجعل الكعبة قبلة وجهك وبدنك ورب الكعبة قبلة روحك و قلبك واعلم أنه على قدر إقبالك على الله يكون إقبال الله عليك وإذا أعرضت أعرض الله عنك,post,2014-11-08 18:48:02,27,
اعلم يا أخي أن الخشوع قيام القلب بين يدي الرب بالخضوع والذل ، ورقة القلب وسكونه وانكساره وحرقته.,post,2014-11-08 18:48:02,28,
العبادة على رؤوس العباد أحلى من التيجان على رؤوس الملوك.,post,2014-11-08 18:48:02,29,
القلب أمير البدن. فإذا خشع القلب .. خشع السمع والبصر والوجه وكل الأعضاء.. حتى الكلام.,post,2014-11-08 18:48:02,30,
صار لرب العرش حين صلاته نجيّا فيا طوباه لو كان يخشع,post,2014-11-08 18:48:02,31,
قال أبو الدرداء : استعيذوا بالله من خشوع النفاق. قالوا: وما خشوع النفاق؟ قال : أن ترى الجسد خاشعا والقلب ليس بخاشع.,post,2014-11-08 18:48:02,32,
قال ابن كثير: والخشوع في الصلاة إنما يحصل لمن فرّغ قلبه لها.. واشتغل بها عما عداها ، وآثرها على غيرها ، وحينئذ تكون راحة له وقرة له.,post,2014-11-08 18:48:02,33,
قال الجنيد : الخشوع تذلل القلوب لعلام الغيوب.,post,2014-11-08 18:48:02,34,
قال الحسن رحمه الله: إياك أن ينظر الله إليك وتنظر إلى غيره .. وتسأل الله الجنة وتعوذ به من النار.. وقلبك ساه لا تدري ما تقول بلسانك.,post,2014-11-08 18:48:02,35,
قال بعض السلف : الصلاة كجارية تهدى إلى ملك من الملوك ، فما الظن بمن يهدى إليه جارية شلاء أو عوراء ...فكيف بصلاة العبد والتي يتقرب بها إلى الله.,post,2014-11-08 18:48:02,36,
قال حذيفة رضي الله عنه : أول ما تفقدون من دينكم الخشوع ، وآخر ما تفقدون من دينكم : الصلاة.,post,2014-11-08 18:48:02,37,
قال سعيد بن جبير في قوله تعالى : ( الذين هم في صلاتهم خاشعون) يعني : متواضعون. لا يعرف من عن يمينه ولا من عن شماله ولا يلتفت من الخشوع لله تعالى.,post,2014-11-08 18:48:02,38,
كان خلف بن أيوب لا يطرد الذباب عن وجهه في الصلاة فقيل له :كيف تصبر؟. قال : بلغني أن الفسّاق يتصبرون تحت السياط ليقال : فلان صبور. وأنا بين يدي ربي ، أفلا أصبر على ذباب يقع علي؟.!!,post,2014-11-08 18:48:02,39,
كان ذو النون يقول في وصف العبّاد : لو رأيت أحدهم وقد قام إلى صلاته ، فلما وقف في محرابه ، واستفتح كلام سيده، خطر على قلبه أن ذلك المقام هو المقام الذي يقوم فيه الناس لرب العالمين ، فانخلع قلبه وذهل عقله.,post,2014-11-08 18:48:02,40,
من الإقبال على الله في الصلاة إقبال العبد على الله بتعظيمه ومراقبته فيعبده عبادة من يراه ويقف بين يديه,post,2014-11-08 18:48:02,41,
من الإقبال على الله في الصلاة إقباله على معاني كلام الله وتدبره للقرآن ولأذكار الصلاة,post,2014-11-08 18:48:02,42,
نسأل الله أن نكون من أهله الخاشعين.,post,2014-11-08 18:48:02,43,
وتمام الخضوع : أن يخضع القلب لله ويذل له ، فيتم بذلك خضوع العبد بباطنه وظاهره لله عز وجل ، ولهذا كان النبي صلى الله عليه وسلم يقول في ركوعه : ( خشع لك سمعي وبصري ومخي وعظمي وما استقلت به قدمي).,post,2014-11-08 18:48:02,44,
ومن الإقبال على الله في الصلاة إقبال العبد على قلبه ليحفظه من الشهوات والوساوس والخواطر الدنيوية التي قد تبطل الصلاة أو تنقص من أجرها,post,2014-11-08 18:48:02,45,
ومن تمام الخشوع لله تعالى في الركوع والسجود : أنه إذا ذلّ لربه بالركوع والسجود وصف ربّه حينئذ بصفات العز والكبرياء. فكأنه يقول : الذل والتواضع وصفي.. والعلو والعظمة والكبرياء وصفك.,post,2014-11-08 18:48:02,46,
تزوج الحارث ابن حسان وكان له صحبة فقيل: أتخرج وإنما بنيت بأهلك في هذه الليلة- أي أنها ليلة زواجه - ؟ فقال: والله إن امرأة تمنعني من صلاة الغداة في جمع لامرأة سوء.,post,2014-11-08 18:48:03,47,
جاء عمر بن الخطاب إلى سعيد بن يربوع فعزّاه في بصره وقال : لا تدع الجمعة ولا الصلاة في مسجد رسول الله صلى الله عليه وسلم .. انظر إلى حرصهم على صلاة الجماعة.,post,2014-11-08 18:48:03,48,
رحم الله رجالا نصبوا أبدانهم لخدمة مولاهم ..وكابدوا العبادة حتى استمتعوا بها.,post,2014-11-08 18:48:03,49,
قال أبو الدرداء في مرضه الذي مات فيه : اسمعوا وبلّغوا من خلفكم : حافظوا على هاتين الصلاتين العشاء والصبح ولو تعلمون ما فيهما لأتيتموها ولو حبوا على مرافقكم وركبكم.,post,2014-11-08 18:48:03,50,
قال أحد العباد : ما سمعت النداء إلا تذكرت هول النداء بالعرض على الله يوم القيامة.,post,2014-11-08 18:48:03,51,
قال ابن المسيب : ما فاتتني الصلاة في جماعة منذ أربعين سنة.,post,2014-11-08 18:48:03,52,
قال ابن مسعود: ولقد رأيتنا وما يتخلف عنها إلا منافق معلوم النفاق. ولقد كان الرجل يؤتى به يهادى بين رجلين حتى يقام في الصف.,post,2014-11-08 18:48:03,53,
قال الذهبي في السير: كان عامر بن عبد قيس يصلي من طلوع الشمس إلى العصر فينصرف وقد انتفخت ساقاه فيقول: يا أمارة السوء إنما خلقت للعبادة.,post,2014-11-08 18:48:03,54,
قال سعيد بن المسيب: من حافظ على الصلوات الخمس في جماعة فقد ملأ البر والبحر عبادة.,post,2014-11-08 18:48:03,55,
قال عدي: ما دخل وقت صلاة حتى أشتاق إليها.,post,2014-11-08 18:48:03,56,
قيل لسعيد بن المسيب : إن طارقا يريد قتلك اجلس في بيتك. فقال : اسمع حي على الفلاح فلا أجيب.,post,2014-11-08 18:48:03,57,
قيل لعامر بن عبد قيس : أتسهو في صلاتك.؟ فقال : أو حديث أحب إلي من القرآن حتى أشتغل به .,post,2014-11-08 18:48:03,58,
قيل لنافع : ما كان يصنع ابن عمر في منزله؟ قال : لا تطيقونه.. الوضوء لكل صلاة والمصحف فيما بينهما.,post,2014-11-08 18:48:03,59,
كان أبي عبدالرحمن السلمي يحمل وهو مريض إلى المسجد.,post,2014-11-08 18:48:03,60,
نقل البخاري عن الأسود .. أنه إذا فاتته الجماعة ذهب إلى مسجد آخر.,post,2014-11-08 18:48:03,61,
وعن نافع : أن ابن عمر كان إذا فاتته العشاء في جماعة أحيا بقية ليلته.,post,2014-11-08 18:48:03,62,
وكان إبراهيم يمكث بعد الصلاة ساعة كأنه مريض.,post,2014-11-08 18:48:03,63,
وهذا حاتم الأصم لما سئل عن صلاته قال : أقوم إلى صلاتي وأجعل الكعبة بين حاجبي والصراط تحت قدمي والجنة عن يميني والنار عن شمالي وملك الموت ورائي وأظنها آخر صلاتي.,post,2014-11-08 18:48:03,64,
يقول ثابت البناني : كابدت الصلاة عشرين سنة واستمتعت بها عشرين سنة.,post,2014-11-08 18:48:03,65,
يقول محمد الحمصي : رأيت ابن أبي الحواري فلما صلى قام يصلي فاستفتح بـ(الحمد لله) إلى (إياك نعبد وإياك نستعين) فطفت حول الكعبة كله ثم رجعت فإذا هو لم يتجاوزها فلم يزل يرددها حتى الصبح.,post,2014-11-08 18:48:03,66,
اشترى الربيع فرسا فغزا فيها ثم أرسل غلامه يسار فقام يصلي وربط فرسه فجاء الغلام فقال: يا ربيع أين فرسك؟ فقال : سرقت يا يسار . قال : وأنت تنظر إليها؟ قال: نعم ..إني كنت أناجي ربي فلم يشغلني عن مناجاة ربي شيء.,post,2014-11-08 18:48:04,67,
قال أبو إسحاق : ذهبت مني الصلاة وضعفت ..وإني لأصلي فما أقرأ وأنا قائم إلا البقرة وآل عمران ... رحمك الله تحزن لأنك لم تستطيع أن تقرأ في الركعة إلا البقرة وآل عمران.,post,2014-11-08 18:48:04,68,
قال أحمد بن هشام : كان يزيد وهشيم معروفين بطول صلاة الليل والنهار.,post,2014-11-08 18:48:04,69,
قال إبراهيم التيمي: إذا رأيت الرجل يتهاون في التكبيرة الأولى .. فاغسل يدك منه.,post,2014-11-08 18:48:04,70,
قال إبراهيم بن وكيع : كان أبي يصلي فلا يبقى في دارنا أحد إلا صلى ..حتى جارية لنا.,post,2014-11-08 18:48:04,71,
قال ابن كثير عن عمر : كان يصلي بالناس العشاء ثم يدخل بيته فلا يزال يصلي إلى الفجر.,post,2014-11-08 18:48:04,72,
قال ابن مهدي عن سفيان الثوري: كنت أرمقه الليلة بعد الليلة فما كان ينام إلا في أول الليل ثم ينتفض فزعا فينادي : النار النار شغلني ذكر النار عن الشهوات .. ثم يقبل على صلاته.,post,2014-11-08 18:48:04,73,
قال الأوزاعي رحمه الله : من أطال قيام الليل هوّن الله عليه وقوف يوم القيامة .,post,2014-11-08 18:48:04,74,
قال الحسين : تزوج عثمان بن أبي العاص امرأة من نساء عمر بن الخطاب فقال : والله ما نكحتها رغبة في مال ولا ولد.. ولكني أحببت أن تخبرني عن ليل عمر.,post,2014-11-08 18:48:04,75,
قال الوليد بن مسلم : ما رأيت أكثر اجتهادا في العبادة من الأوزاعي.,post,2014-11-08 18:48:04,76,
قال الوليد ين مسلم: كان سعيد بن عبدالعزيز يحيي الليل فإذا طلع الفجر جدّد وضوءه وخرج إلى المسجد.,post,2014-11-08 18:48:04,77,
قال ثابت: صحبت أنس بن مالك أربعين سنة .. ما رأيت أعبد منه.,post,2014-11-08 18:48:04,78,
قال سفيان بن عيينة : لا تكن مثل عبد سوء. لا يأتي حتى يدعى ... ائت الصلاة قبل النداء.,post,2014-11-08 18:48:04,79,
قال مالك: كان عبيد الله بن عتبة يطول الصلاة ولا يعجل عنها لأحد.,post,2014-11-08 18:48:04,80,
قال محمد الصوري: كان سعيد إذا فاتته صلاة الجماعة بكى.,post,2014-11-08 18:48:04,81,
كان علي بن الحسين إذا قام إلى الصلاة أخذته رعدة فقيل له في ذلك فقال: تدرون بين يدي من أقوم.. ومن أناجي.,post,2014-11-08 18:48:04,82,
كانت أم منصور تقول لمنصور: إن لعينيك عليك حقا ولجسمك عليك حقا فكان يقول لها : دعي عنك منصورا فإن بين النفختين نوما طويلا.,post,2014-11-08 18:48:04,83,
محيي الليل صلاة لا يقطعها إلا بدمع من الإشفاق منسجم,post,2014-11-08 18:48:04,84,
وقال أبي عثمان النهدي: تضيفت أبا هريرة سبعا .. فكان هو وامرأته وخادمه يقسمون الليل على ثلاثا يصلي هذا ثم يوقظ هذا.,post,2014-11-08 18:48:04,85,
وقد قال عمر بن الخطاب لمعاوية بن خديج: لئن نمت بالنهار لأضيعن رعيتي.. ولإن نمت بالليل لأضيعن نفسي .. فكيف بالنوم مع هذين يا معاوية.,post,2014-11-08 18:48:04,86,
اللهم اجعلنا من المصلين العابدين الذاكرين واحشرنا مع إمام المصلين صلى الله علي وسلم.,post,2014-11-08 18:48:05,87,
بكى الباكون للرحمن ليلا وباتوا دمعهم لا يسأمونا بقاع الأرض من شوق إليهم تحن متى عليها يسجدونا,post,2014-11-08 18:48:05,88,
قال أبو بكر بن عياش: رأيت حبيب بن أبي ثابت ساجداً، فلو رأيته قلت: ميت. يعني من طول السجود.,post,2014-11-08 18:48:05,89,
قال أبو قطن: ما رأيت شعبة ركع قطُّ إلا ظننت أنه نسي، ولا قعد بين السجدتين إلا ظننت أنه نسي.,post,2014-11-08 18:48:05,90,
قال ابن عباس رضي الله عنهما : ' ركعتان مُقتصدتان في تفكر خير من قيام ليلة والقلب ساه',post,2014-11-08 18:48:05,91,
قال ابن وهب: رأيت الثوري في الحرم بعد المغرب صلى ثم سجد سجدة فلم يرفه حتى نودي بالعشاء.,post,2014-11-08 18:48:05,92,
"قال الامام على - رضى الله عنه - : من أصلح بينه وبين الله أصلح الله ما بينه وبين الناس , ومن أصلح أمر آخرته , أصلح الله أمر دنياه , ومن كان من نفسه واعظ , كان عليه من الله حافظ.",post,2014-11-08 18:48:05,93,
قال بعضهم: ركع ابن الزبير يوماً فقرأت البقرة وآل عمران والنساء والمائدة وما رفع رأسه.,post,2014-11-08 18:48:05,94,
قال عبدان الأهوازي: كنا لا نصلي خلف هدبة من طول صلاته، يسبح في الركوع والسجود نيفاً وثلاثين تسبيحة.,post,2014-11-08 18:48:05,95,
قال علي بن الفضيل: رأيت الثوري ساجداً فطفت سبعة أسابيع- أي 49 شوطاً- قبل أن يرفع رأسه.,post,2014-11-08 18:48:05,96,
كان طلق بن حبيب لا يركع في صلاته إذا افتتح سورة (البقرة) حتى يبلغ (العنكبوت)، وكان يقول: أشتهي أن أقوم حتى يشتكي صلبي.,post,2014-11-08 18:48:05,97,
لما زفت إلى صلة الأشيم معاذة العدوية أدخله ابن أخيه الحمام ثم أدخله بيتا طيبا فقام يصلي حتى الصبح. وفعلت معاذة كذلك فلما أصبح عاتبه ابن أخيه على ذلك فقال له : إنك أدخلتني بيتا أذكرتني به النار ثم أدخلتني بيتا أذكرتني به الجنة فما زالت فكرتي فيهما حتى أصبحت.,post,2014-11-08 18:48:05,98,
وقال بكر بن عبد الله ' { يا ابن آدم إذا شئت أن تدخل على مولاك بغير إذن وتكلمه بلا ترجمان دخلت ؛ قيل : وكيف ذلك ؟ قال : تُسبغ وضوءك ؛ وتدخل محرابك ؛ فإذا أنت قد دخلت على مولاك بغير إذن فتُكلمه بغير ترجمان } .,post,2014-11-08 18:48:05,99,
وقيل لخلف بن أيوب ألا يُؤذيك الذباب في صلاتك فتطردها ؟ قال : لا أُعود نفسي شيئا يُفسد عليّ صلاتي ؛ قيل له وكيف تصبر على ذلك ؟ قال بلغني أن الفُساق يصبرون تحت أسواط السلطان ليُقال فلان صبور ويفتخرون بذلك ؛ فأنا قائم بين يدي ربي أفأتحرك لذبابة ..,post,2014-11-08 18:48:05,100,
وكان سعيد التنوخي إذا صلى لم تنقطع الدموع من خديه على لحيته ..,post,2014-11-08 18:48:05,101,
وكان علي بن أبي طالب رضي الله عنه وكرم وجهه إذا حضر وقت الصلاة يتزلزل ويتلون وجهه ؛ فقيل له مالك يا أمير المؤمنين ؛ فيقول جاء وقت أمانة عرضها الله على السموات والأرض والجبال فأبين أن يحملنها وأشفقن منها وحملتها ..,post,2014-11-08 18:48:05,102,
ويُروى أن الحسن نظر إلى رجل يعبث بالحصى ويقول اللهم زوجني الحور العين ؛ فقال بئس الخاطب أنت ؛ تخطب الحور العين وأنت تعبث بالحصى ..,post,2014-11-08 18:48:05,103,
ويُروى عن علي بن الحسين أنه كان إذا توضأ اصفر لونه فيقول له أهله ما هذا الذي يعتريك عند الوضوء فيقول أتدرون بين يدي من أريد أن أقوم ؟,post,2014-11-08 18:48:05,104,
أين النائمون عن صلاة الفجر و العصر الذين أنعم الله عليهم وأصحّ لهم أجسامهم ؟ وما عذرهم أمام الله تعالى ؟.    منائركم علت في كل حيٍّ ... ومسجدكم من العُبـَّـاد خالي    وصوت أذانكم في كل وادٍ ... ولكن أين صوتٌ من بلالِ,post,2014-11-08 18:48:06,105,
المحبون يقولون: نصلي فنستريح بصلاتنا، كما قال إمامهم وقدوتهم ونبيهم صلى الله عليه وسلم: « يا بلال أرحنا بالصلاة » . ولم يقل: أرحنا منها، وقال صلى الله عليه وسلم: « جُعلت قرة عيني في الصلاة » . فمن جعلت قرة عينه في الصلاة، كيف تقر عينه بدونها؟! وكيف يطيق الصبر عنها؟!,post,2014-11-08 18:48:06,106,
ذكر بعضهم أن حجراً من المنجنيق وقع على شرفة المسجد فطارت فلقة منها فمرت بين لحية ابن الزبير وحلقه، وهو قائم يصلي، فما زال عن مقامه، ولا عرف ذلك في صوته، ولا قطع لها قراءته، ولا ركع دون ما كان يركع، فكان إذا دخل في الصلاة خرج من كل شيء إليها.,post,2014-11-08 18:48:06,107,
روي أن ابن الزبير كان يوماً يصلي فسقطت حية من السقف تطوقت على بطن ابنه هاشم، فصرخ النسوة وانزعج أهل المنزل، واجتمعوا على قتل الحية، فقتلوها وسلم الولد، فعلوا هذا كله وابن الزبير في الصلاة لم يلتفت، ولا درى بما جرى لابنه حتى سلّم.,post,2014-11-08 18:48:06,108,
روي أنه وقع حريق في دار مسلم بن يسار وأطفىء، وهو يصلي، فلما ذكر ذلك له قال: ما شعرت.,post,2014-11-08 18:48:06,109,
