post_content,post_type,post_date,ID,seen
قال ابن القيم رحمه الله في شرح وصية نبي الله يحيى بن زكريا عليهما السلام وقوله في: «وأن الله أمركم بالصلاة، فإذا صليتم فلا تلتفتوا؛ فإن الله ينصب وجهه لوجه عبده في صلاته مالم يلتفت» [رواه البخاري].,post,2014-11-08 18:48:10,186,
قال رسول الله -صلَّى الله عليه وسلَّم-: «من شهد الجنازة حتَّى يصلِّي فله قيراط، ومن شهد حتَّى تدفن كان له قيراطان». قيل: وما القيراطان؟ قال: «مثل الجبلين العظيمين» [متفقٌ عليه].,post,2014-11-08 18:48:10,187,
مثّل من يلتفت في صلاته ببصره أو بقلبه، مثل رجل قد استدعاه السلطان، فأوقفه بين يديه، وأقبل يناديه ويخاطبه، وهو في خلال ذلك يلتفت عن السلطان يميناً وشمالاً، وقد انصرف قلبه عن السلطان، فلا يفهم ما يخاطبه به، لأن قلبه ليس حاضراً معه، فما ظن هذا الرجل أن يفعل به السلطان، أفليس أقل المراتب في حقه أن ينصرف من بين يديه ممقوتاً مبعداً قد سقط من عينيه؟,post,2014-11-08 18:48:10,188,
والعبد قديكون نسي الشيء والحاجة، وأيس منها، فيذكره الشيطان إياها في الصلاة ليشغل قلبه بها، ويأخذه عن الله عز وجل، فيقوم فيها بلا قلب، فلا ينال من إقبال الله تعالى وكرامته وقربه ما يناله المقبل على ربه عز وجل الحاضر بقلبه في صلاته، فينصرف من صلاته مثل ما دخل فيها بخطاياه وذنوبه وأثقاله، لم تخفف عنه بالصلاة، فإن الصلاة إنما تكفر سيئات من أدى حقها، وأكمل خشوعها، ووقف بين يدي الله تعالى بقلبه وقالبه.,post,2014-11-08 18:48:10,189,
ويكره في الصلاة أن يستند إلى جدار ونحوه حال القيام، إلا من حاجة، لأنّه يزيل مشقة القيام، فإن فعله لحاجة - كمرض ونحوه فلا بأس.,post,2014-11-08 18:48:10,190,
ويكره في الصلاة إقعاؤه في الجلوس، وهو أن يفرش قدميه ويجلس على عقبيه، لقوله صلى الله عليه وسلم: «إذا رفعت رأسك من السجود فلا تقع كما يقعي الكلب».,post,2014-11-08 18:48:10,191,
ويكره في الصلاة افتراش ذراعيه حال السجود، بأن يمدهما على الأرض مع إلصاقهما بها، قال صلى الله عليه وسلم: «اعتدلوا في السجود، ولا يبسط أحدكم ذراعيه انبساط الكلب» وفي حديث آخر «ولا يفترش ذراعيه افتراش الكلب».,post,2014-11-08 18:48:10,192,
ويكره في الصلاة التخصر، وهو وضع اليد على الخاصرة، وهي الشاكلة ما فوق رأس الورك من المستدق، وذلك لأنّ التخصر فعل الكفار المتكبرين، وقد نهينا عن التشبه بهم، وقد ثبت في الحديث المتفق عليه النهي عن أن يصلي الرجل متخصراً.,post,2014-11-08 18:48:10,193,
ويكره في الصلاة العث - وهو اللعب - وعمل ما لا فائدة فيه بيد أو رجل، أو لحية أو ثوب، أو غير ذلك، ومنه مسح الأرض من غير حاجة.,post,2014-11-08 18:48:10,194,
ويكره في الصلاة تغميض عينيه لغير حاجة، لأنّ ذلك من فعل اليهود، وإن كان التغميض لحاجة، كأن يكون أمامه ما يشوش عليه صلاته كالزخارف والتزويق، فلا يكره إغماض عينيه عنه، هذا معنى ما ذكره ابن القيم-رحمه الله.,post,2014-11-08 18:48:10,195,
ويكره في الصلاة رفع بصره إلى السماء، فقد أنكر النبي صلى الله عليه وسلم على من يفعل ذلك، فقال: «ما بال أقوام يرفعون أبصارهم إلى السماء في صلاتهم؟!» واشتد قوله في ذلك، حتى قال: «لينتهنّ أو لتخطفنّ أبصارهم».,post,2014-11-08 18:48:10,196,
يكره للمسلم في الصلاة الالتفات بوجهه وصدره لقول النبي صلى الله عليه وسلم: «وهو اختلاس يختلسه الشيطان من صلاة العبد»، إلا أن يكون ذلك لحاجة، فلا بأس به، كما في حالة الخوف، أو كان لغرض صحيح.    فإن استدار بجميع بدنه، أو استدبر الكعبة في غير حالة الخوف بطلت صلاته، لتركه الاستقبال بلا عذر.,post,2014-11-08 18:48:10,197,
ينبغي أن يكون نظر المصلي إلى موضع سجوده، فلا ينبغي له أن يسرح بصره فيما أمامه من الجدران، والنقوش والكتابات ونحو ذلك، لأنّ ذلك يشغله عن صلاته.,post,2014-11-08 18:48:10,198,
إذا كان أمام المصلي سترة (أي: شيء مرتفع من جدار أو نحوه) فلا بأس أن يمر ورائها المار، وكذا إذا كان يصلي في الحرم، فلا يمنع المرور بين يديه، لأنّ النبي صلى الله عليه وسلم كان يصلي يمكة والنّاس يمرون بين يديه وليس دونهم سترة.,post,2014-11-08 18:48:11,199,
فالمطلوب إقامة الصلاة بحضور القلب والخشوع، والإتيان بما يشرع لهما، وترك ما ينافيهما أو ينقصهما من الأقوال والأفعال، لتكون صلاة صحيحة مبرئة لذمة فاعلها، ولتكون صلاة في صورتها وحقيقتها، لا في صورتها فقط.,post,2014-11-08 18:48:11,200,
"قال الشيخ الفوزان حفظه الله : ولا يكره السلام على المصلي إذا كان يعرف كيف يرد , وللمصلي حينئذ رد السلام في حال الصلاة بالإشارة لا باللفظ ; فلا يقول : وعليكم السلام , فإن رده باللفظ ; بطلت به صلاته ; لأنه خطاب آدمي , وله تأخير الرد إلى ما بعد السلام . الشيخ صالح الفوزان الملخص الفقهي (في بيان ما يكره في الصلاة)",post,2014-11-08 18:48:11,201,
لا ينبغي للمصلى أن يكثر من الأفعال المباحة في الصلاة إلا لضرورة، فإن أكثر منها من غير ضرورة، وكانت متوالية أبطلت الصلاة، لأنّ ذلك مما ينافي الصلاة ويشغل عنها.,post,2014-11-08 18:48:11,202,
وإذا التبست القراءة على الإمام، فللمأموم أن يسمعه القراءة الصحيحة.,post,2014-11-08 18:48:11,203,
وإذا عرض للمصلي أمر كاستئذان عليه، أو سهو إمامه، أو خاف على انسان الوقوع في هلكه فله التنبيه على ذلك، بأن يسبح الرجل وتصفق المرأة، لقوله صلى الله عليه وسلم: «إذا نابكم شيء في صلاتكم، فلتسبح الرجال، ولتصفق النساء».,post,2014-11-08 18:48:11,204,
واتخاذ السترة سنة في حق المنفرد والإمام، لقوله صلى الله عليه وسلم: «إذا صلى أحدكم فليصل إلى سترة، ويدن منها» [رواه أبو داود وابن ماجه من حديث أبي سعيد]، وأما المأموم فسترته إمامه.,post,2014-11-08 18:48:11,205,
والمطلوب من المسلم أن يتجه إلى صلاته بكليته، ولا يتشاغل عنها بما ليس منها، يقول الله سبحانه: { حَافِظُوا عَلَى الصَّلَوَاتِ وَالصَّلَاةِ الْوُسْطَى وَقُومُوا لِلَّهِ قَانِتِينَ } [البقرة: الآية 238].,post,2014-11-08 18:48:11,206,
وتكره الصلاة في مكان فيه تصاوير، لما فيه من التشبه بعبادة الأصنام- سواء كانت الصورة منصوبة أو غير منصوبة على الصحيح.,post,2014-11-08 18:48:11,207,
وكذا يكره دخوله في الصلاة بعد حضور طعام يشتهيه، لقوله عليه الصلاة والسلام: «لا صلاة بحضرة طعام، ولا هو يدافعه الأخبثان» وذلك كله رعاية لحق الله تعالى ليدخل العبد في العبادة بقلب حاضر مقبل على ربّه.,post,2014-11-08 18:48:11,208,
وليس اتخاذ السترة بواجب، لحديث ابن عباس «أنّه صلى الله عليه وسلم في فضاء ليس بين يديه شيء». [رواه أحمد وأو داود].    وينبغي أن تكون السترة قائمة كمؤخرة الرجل، أي: قدر ذراع، سواء كانت دقيقة أو عريضة.    والحكمة في اتخاذها، لتنمع المار بين يديه، ولتمنع المصلي من الانشغال بما وراءها.    وإن كان في صحراء، صلى إلى شيء شاخص من شجر أو حجر أو عصا، فإن لم يمكن غرز العصا في الأرض، وضعه بين يديه عرضاً.,post,2014-11-08 18:48:11,209,
ويباح للمصلي لبس الثوب ونحوه، وحل شيء ووضعه، وفتح الباب، وله قتل حية وعقرب، لأنّه صلى الله عليه وسلم «أمر بقتل الأسودين في الصلاة الحية والعقرب» [رواه أبو داود والترمذي وصححه],post,2014-11-08 18:48:11,210,
ويجوز للمصلي أن يقرأ عدة سور في ركعة واحدة، لما في (الصحيح): أنّ النبي صلى الله عليه وسلم قرأ في ركعة من قيامه بالبقرة وآل عمران والنساء,post,2014-11-08 18:48:11,211,
ويكره أن يدخل في الصلاة وهو مشوش الفكر بسبب وجود شيء يضايقه -كاحتباس بول، أو غائط أو ريح، أو حالة برد أو حر شديدين، أو جوع أو عطش مفرطين، لأنّ ذلك يمنع الخشوع.,post,2014-11-08 18:48:11,212,
ويكره في الصلاة فرقعة أصابعه وتشبيكها.,post,2014-11-08 18:48:11,213,
ويكره في الصلاة مسح جبهته وأنفه ممّا علق بهما من أثر السجود، ولا بأس بمسح ذلك بعد الفراغ من الصلاة.,post,2014-11-08 18:48:11,214,
ويكره للمصلي أن يخص جبهته بما يسجد عليه، لأنّ ذلك من شعار الرافضة، ففي ذلك الفعل تشبه بهم.,post,2014-11-08 18:48:11,215,
يجوز أن يقسم السورة الواحدة بين ركعتين,post,2014-11-08 18:48:11,216,
يجوز للمصلى أن يكرر قراءة السورة في ركعتين,post,2014-11-08 18:48:11,217,
يسن للمصلي رد المار من أمامه قريباً منه، لقول النبي صلى الله عليه وسلم: «إذا كان أحدكم يصلي، فلا يدعن أحداً يمر بين يديه، فإن أبى فليقاتله، فإن معه قرين»,post,2014-11-08 18:48:11,218,
أخي المسلم: أمر الخشوع في الصَّلاة عظيمٌ، وقد تهاون به كثير من المصلِّين.. حتَّى إنَّك نادرًا ما ترى خاشعًا في صلاته!    وقد أخبرنا النَّبيُّ -صلَّى الله عليه وسلَّم- أن الخشوع أوَّل ما يرفع من هذه الأمَّة.    قال النَّبيُّ -صلَّى الله عليه وسلَّم-: «أوَّل شيءٍ يرفع من هذه الأمَّة الخشوع، حتَّى لا ترى فيها خاشعًا» [رواه الألباني 542 في صحيح التَّرغيب وقال: حسن صحيح].,post,2014-11-08 18:48:12,219,
أخي المسلم: إذا قمت إلى صلاتك؛ تذكر أنَّك تقف بين يدي ملك الملوك.. المطلع على السِّرِّ وأخفى!,post,2014-11-08 18:48:12,220,
أخي المسلم: إنَّ لكلِّ شيءٍ زينةٍ.. والخشوع زينةُ الصَّلاة وبهاؤها، وصلاةٌ بلا خشوعٍ؛ كليلٍ بلا قمرٍ.. وكنهارٍ بلا شمسٍ!,post,2014-11-08 18:48:12,221,
أخي المسلم: لقد أصبح عدم الخشوع في الصَّلاة آفة الكثيرين؛ فتجد أحدهم يدخل في الصَّلاة بنيَّةٍ ضعيفةٍ! ومن كانت هذه نيته؛ فإنَّه لن يصلِّي صلاةً خاشعةً، بل ستكون صلاته مجرد حركات يؤدِّيها؛ لا معنى لها! بل من كانت هذه حاله؛ فلن يتذوق لذَّة وثمار الصَّلاة! بل والأشدّ من ذلك؛ أن همه سيكون مصروفًا إلى نهايتها؛ فتراه يسابق أركانها وحركاتها؛ حتى يفرغ منها!,post,2014-11-08 18:48:12,222,
أين قلبك أيُّها المصلِّي حين تقف أمام ربِّك -تعالى-؟!    أتراه معك في صلاتك؟ أم هو خارجها بعيدًا عنك؟!,post,2014-11-08 18:48:12,223,
فها أنت تقف بين يدي الله -تعالى- خمس مرَّات في اليوم والليلة.. فهل أحسست بعظمة من تقف بين يديه؟!    فإن لم تجد لذلك أثرًا؛ فحاسب نفسك.. وذكرها بعظمة هذا الموقف؟,post,2014-11-08 18:48:12,224,
قال ابن عمر -رضي الله عنهما-: 'كانوا إذا قاموا في الصَّلاة أقبلوا على صلاتهم، وخفضوا أبصارهم إلى موضع سجودهم، وعلموا أنَّ الله يقبل عليهم، فلا يلتفتون يمينًا ولا شمالًا'.,post,2014-11-08 18:48:12,225,
قال رسول الله -صلَّى الله عليه وسلَّم-: «لا تجزئ صلاة لا يقيم الرَّجل فيها صلبه في الرُّكوع والسُّجود» [رواه النَّسائي 1026 وابن ماجه 717 وصحَّحه الألباني].,post,2014-11-08 18:48:12,226,
قليل أولئك الَّذين فهموا معنى الصَّلاة.. ودخلوا فيها بنيَّةٍ صادقةٍ!    قال بعضهم: 'الصَّلاة من الآخرة، فإذا دخلت فيها؛ خرجت من الدُّنيا'.,post,2014-11-08 18:48:12,227,
كان زين العابدين علي بن الحسين -رضي الله عنهما- إذا توضأ اصفر وتغيَّر، فيقال: ما لك؟! فيقول:     'أتدرون بين يدي من أريد أن أقوم؟'.,post,2014-11-08 18:48:12,228,
وعن أبي عبد الله الأشعري -رضي الله عنه- أنَّ رسول الله -صلَّى الله عليه وسلَّم- رأي رجلًا لا يتمُّ ركوعه، وينقر في سجوده وهو يصلِّي فقال رسول الله -صلَّى الله عليه وسلَّم-: «أترون هذا من مات على هذا، مات على غير ملَّة محمَّد» ثمَّ قال رسول الله -صلَّى الله عليه وسلَّم-: «مثل الَّذي يركع وينقر في سجوده كالجائع لا يأكل إلا التَّمرة والتَّمرتين فماذا تغنيان عنه» [رواه ابن خزيمة 665 وحسَّنه الألباني].,post,2014-11-08 18:48:12,229,
وقال -صلَّى الله عليه وسلَّم-: «إنَّ الرَّجل ليصلي ستين سنة وما تقبل له صلاة، لعله يتمّ الرُّكوع، ولا يتمّ السُّجود، ويتمّ السُّجود ولايتمّ الرُّكوع» [حسَّنه الألباني 529 في صحيح التَّرغيب].,post,2014-11-08 18:48:12,230,
وقال الحسن البصري -رحمه الله-: 'كان خشوعهم في قلوبهم؛ فغضُّوا بذلك أبصارهم، وخفضوا لذلك الجناح'.,post,2014-11-08 18:48:12,231,
وقال الرَّبيع بن خثيم -رحمه الله-: 'ما دخلت في صلاة قط فأهمني فيها إلا ما أقول ، وما يقال لي'.,post,2014-11-08 18:48:12,232,
وقال رسول الله -صلَّى الله عليه وسلَّم-: «لا ينظر الله -عزَّ وجلَّ- إلى صلاة عبد لا يقيم فيها صلبه بين ركوعها وسجودها» [صحَّحه الألباني في تخريج مشكاة المصابيح].,post,2014-11-08 18:48:12,233,
وقال رسول الله -صلَّى الله عليه وسلَّم-: «وأسوأ السَّرقة الَّذي يسرق صلاته قالوا: وكيف يسرق صلاته؟ قال: لا يتم ركوعها و لا سجودها» [رواه الألباني 534 وقال: صحيحٌ لغيره].,post,2014-11-08 18:48:12,234,
وقد مدح الله -تعالى- أولياءه بالخشوع في الصَّلاة ..    فقال -تعالى-: {قَدْ أَفْلَحَ الْمُؤْمِنُونَ (1) الَّذِينَ هُمْ فِي صَلاتِهِمْ خَاشِعُونَ} [المؤمنون: 1-2].,post,2014-11-08 18:48:12,235,
وللمصلي أن يستعيذ عند قراءة آية فيها ذكر عذاب، وأن يسأل الله عند قراءة آية فيها ذكر رحمة، وله أن يصلي على النبي صلى الله عليه وسلم عند قراءة آية فيها ذكره، لتأكد الصلاة عليه عند ذكره.,post,2014-11-08 18:48:12,236,
وليعلم أنّ الصلاة عبادة عظيمة لا يجوز أن يفعل أو يقال فيها إلاّ في حدود الشرع الوارد عن الرسول صلى الله عليه وسلم فعليك بالاهتمام بها ومعرفة ما يكملها وما ينقصها، حتى تؤديها على الوجه الأكمل.,post,2014-11-08 18:48:12,237,
أخي المسلم: لا تكن كحال ذاك الغافل! الَّذي إذا دخل في صلاته؛ ابتدرته الشَّواغل وأحاطت به الوساوس!,post,2014-11-08 18:48:13,238,
أخي المسلم: هكذا كان الصَّالحون يعشون لحظات الصَّلاة بقلوبهم.. ولا يخلطون معها شيئًا من أمور الدنيا .. وحظوظ النَّفس الأمارة بالسُّوء.,post,2014-11-08 18:48:13,239,
إحفظ صلاتك من كيد الشَّيطان,post,2014-11-08 18:48:13,240,
إذا أردت الصَّلاة؛ فإن أول ما ينبغي لك أن تفعله أن تفرغ قلبك من مشاغله؛ حتَّى تدخل في صلاتك بقلبٍ خالٍ من مشاغل الدُّنيا..,post,2014-11-08 18:48:13,241,
إذا دخلت في صلاتك فادخل فيها بنيَّةٍ صادقةٍ، وإقبال على من وقفت بين يديه مناجيًا له -تبارك وتعالى-.. وتفقد قلبك في صلاتك؛ فإن وجدت منه غفلة؛ فرده إلى الطَّريق.. ولا تطلق له العنان؛ فيهرب منك، ويتركك في صلاتك؛ تحياها ببدنك وحده.,post,2014-11-08 18:48:13,242,
إنَّ بعض النَّاس لا يتذكر مشاغله؛ إلا إذا دخل في الصَّلاة فتجده مع الصَّلاة ببدنه، وأمَّا قلبه ففي عالم آخر!    يتذكر مشاريعه؛ كم ربح؟! وكم خسر؟!    يتذكر ماذا أعطى؟! وماذا أخذ؟!    يتذكر ماذا قال؟! وما قيل له؟!    يفكر أين سيذهب اليوم؟! وماذا سيفعل؟!,post,2014-11-08 18:48:13,243,
إنَّ فضل الصَّلاة وشرفها عظيمٌ؛ فكيف تطيب نفسك أيُّها السَّاهي أن تفرط في هذا الخير كلّه؟!,post,2014-11-08 18:48:13,244,
تريد أن يكون حالك كما قال عمر بن الخطاب، يوم أن قال: 'إنَّ الرَّجل ليشيب عارضاه في الإسلام، وما أكمل لله -تعالى- صلاةً' قيل: كيف ذلك؟ قال:     'لا يتمُّ خشوعها وتواضعها وإقباله على الله -عزَّ وجلَّ- فيها'.,post,2014-11-08 18:48:13,245,
جاء عن الرَّبيع بن خثيم -رحمه الله- أنَّه كان يصلِّي، فسرق فرسه، فقال له غلامه: يسرق فرسلك، وأنت تنظر إليه، هذا عمل النَّاس؟! فقال:     'كنت بين يدي الله -عزَّ وجلَّ-، فلم أكن أصرف وجهي عن الله -عزَّ وجلَّ-'.,post,2014-11-08 18:48:13,246,
عن عائشة -رضي الله عنها-، قالت: سألت رسول الله -صلَّى الله عليه وسلَّم- عن الالتفات في الصَّلاة؟ فقال: «هو اختلاس يختلسه الشَّيطان من صلاة العبد» [رواه البخاري 751].,post,2014-11-08 18:48:13,247,
فلتعلم أيُّها المصلِّي أنَّ الصَّلاة غيظ للشَّيطان . فإنَّ إبليس لا يرضيه أن يراك ساجدًا لله -تعالى-.. مقبلًا على ذكره ومناجاته..    بل يسرَّه أن تكون من الغافلين عن صلاتهم.. السَّاهين عن إقامتها!,post,2014-11-08 18:48:13,248,
قال النَّبيُّ -صلَّى الله عليه وسلَّم-: «إذا أقيمت الصَّلاة وحضر العشاء، فابدؤوا بالعشاء» [رواه البخاري 5465 ومسلم 557].,post,2014-11-08 18:48:13,249,
كم قبيح بالمسلم أن يصلِّي صلاةً بلا خشوعٍ.. ويقبل على صلاته بنيَّةٍ غير صادقةٍ!,post,2014-11-08 18:48:13,250,
وجاء عن يعقوب القارئ -رحمه الله- أنَّه كان في الصَّلاة، فجاء لصٌّ فاختلس رداءه، فذهب به إلى أصحابه، فعرفوا رداءه.    فقيل له: ردَّه إلى الرَّجل الصَّالح، إنَّا نخاف دعاءه. فجاء فوضعه على كتفه، واعتذر إليه من صنيعه، فلمَّا فرغ من صلاته أخبر بذلك، فقال:     'إني لم أشعر من رفعه، ولا من وضعه؟'.,post,2014-11-08 18:48:13,251,
وعن عائشة -رضي الله عنها- أنَّ النَّبيَّ -صلَّى الله عليه وسلَّم- صلَّى في خميصةٍ لها أعلام، فنظر إلى أعلامها نظرة، فلمَّا انصرف، قال: «اذهبوا بخميصتي هذه إلى أبي جهم، وأتوني بأنبجانية أبي جهم فإنَّها ألهتني آنفًا عن صلاتي» [رواه البخاري 373].,post,2014-11-08 18:48:13,252,
وقال -صلَّى الله عليه وسلَّم-: «لا صلاة بحضرة الطَّعام، ولا هو يدافعه الأخبثان» [رواه مسلم 560].,post,2014-11-08 18:48:13,253,
وقيل لعامر بن عبد الله -رحمه الله-: هل تحدثك نفسك في الصَّلاة بشيءٍ؟ قال: نعم، بوقوفي بين يدي الله -عزَّ وجلَّ-، ومنصرفي إحدى الدَّارين! قيل: هل تجد شيئًا ممَّا نجد من أمور الدُّنيا؟ قال:     'لأن تختلف الأسنة فيَّ أحبَّ إليَّ من أن أجد في صلاتي ما تجدون'.,post,2014-11-08 18:48:13,254,
ولا تظنن أيُّها المصلِّي أن تضييع الصَّلاة يكون فقط في أوقاتها؛ بل إن من لم يخشع في صلاته، ولم يكمل أركانها؛ يعدُّ أيضًا من المضيعين لها..,post,2014-11-08 18:48:13,255,
ومن كانت تلك حاله؛ فإنَّه لا شكّ سيربح الكثير من صلاته! فتأمل أيُّها المصلِّي في تلك المواقف لأهل الخشوع بعين التَّفكر والاعتبار.. وقارن بذلك حالك. ثمَّ حاسب نفسك على تفريطها وتقصيرها..,post,2014-11-08 18:48:13,256,
: لا تتهاون في الأفعال الَّتي لها صلة بالصَّلاة؛ كالوضوء، فإنَّ الكثيرين لا يحرصون على فعل الوضوء كما ثبت عنِ النَّبيِّ -صلَّى الله عليه وسلَّم-، فالواجب على المسلم الاقتداء بالنَّبيِّ -صلَّى الله عليه وسلَّم- في ذلك، في غير ذلك.,post,2014-11-08 18:48:14,257,
أخي المسلم: إنَّها الصَّلاة! خيرُ ذخرٍ تدخره لنفسك في الدُّنيا والآخرة.. فلا تفرطنَّ فيها.. وشُدَّ بالنَّواجذ عليها!.,post,2014-11-08 18:48:14,258,
أخي المسلم: ذلك هو الخشوع.. وذلك هو فضله.. وما جاء من وعيدٍ في حقِّ من فرَّط فيه ..    فانظر في حالك.. وتأمَّل في صلاتك؛ كيف تؤدِّيها؟!,post,2014-11-08 18:48:14,259,
أخي المسلم.. إنَّ الخاشع في صلاته فائزٌ في الدَّارين.. ففي الدُّنيا: يفوز بثمرات الصَّلاة؛ الَّتي يفوز بها أهل الخشوع.. وفي الآخرة: يفوز برضا الله -تعالى-، ودخوله الجنَّة..,post,2014-11-08 18:48:14,260,
