post_content,post_type,post_date,ID,seen
أسبغ وضوءك، وأكثر خُطاك إلى المساجد وانتظر الصلاة بعد الصلاة.,post,2014-11-08 18:48:19,335,
إن من ثمرات الصلاة أنها أفضل القربات، فليس هناك عمل يُتقرب به إلى الله أحب منها، يقول الله في الحديث القدسي: «وما تقرب إلي عبدي بأحب إلي مما أفترضه عليه» [رواه البخاري],post,2014-11-08 18:48:19,336,
إياك والإلتفات في الصلاة أو النظر إلى الساعة والعبث بالملابس فإنه خلاف الخشوع.,post,2014-11-08 18:48:19,337,
احرص على الصلاة في الصف الأول، ولاتخرج من المسجد قبل إتيانك بأذكار الصلاة.,post,2014-11-08 18:48:19,338,
تدبر ما يتلى عليك من القرآن أثناء الصلاة.,post,2014-11-08 18:48:19,339,
حافظ على النوافل وبخاصة صلاة الوتر، وصل في الليل ولو ركعتين.,post,2014-11-08 18:48:19,340,
روح الصلاح الخشوع، فصل صلاة خاشعة.,post,2014-11-08 18:48:19,341,
قال الإمام ابن القيم رحمه الله: 'لعل هذه الحركات من قيام وسجود وركوع تحليلاً للمواد، وتقوية للجسد، فالصلاة من أكبر الأدوية'.,post,2014-11-08 18:48:19,342,
كن على طهارة دائما، مستعدا لنداء الرحمن.,post,2014-11-08 18:48:19,343,
نم مبكرا وعلى طهارة لتتمكن من القيام لصلاة الفجر بسهولة.,post,2014-11-08 18:48:19,344,
وإن من ثمرات الصلاة أنها السبب لحدوث السجود يوم القيامة عندما يمتاز المؤمنون عن المنافقون,post,2014-11-08 18:48:19,345,
وإن من ثمرات الصلاة نزول الرحمات على العبد مادام في صلاته حتى ينصرف، وحفوف الملائكة به.,post,2014-11-08 18:48:19,346,
وقال صلى الله عليه وسلم: «الصلاة خير موضع، فمن أستطاع منكم أن يستكثر فليفعل»، فالصلاة مقربة من الربَّ، أضف إلى هذا أن أقرب ما يكون العبد من ربه وهو ساجد، قال تعالى: {وَاسْجُدْ وَاقْتَرِبْ} [سورة العلق: 19]، فعلى قدر ذكر العبد لله يكون قربه منه، وعلى قدر غفلته يكون بعده عنه.,post,2014-11-08 18:48:19,347,
ومن ثمرات الصلاة أنها مطردة للداء من الجسد، فكم عرفنا من المرضى من فشلت العقاقير الطبية في علاجهم، فلما توجهوا للصلاة برأت عللهم وشفى الله أمراضهم، وخصوصاً صلاة الليل,post,2014-11-08 18:48:19,348,
ومن ثمرات الصلاة أنها مكفرة للسيئات، ولم خص الله عملاً من الأعمال فجعله مكفراً للذنوب كما هو حاصل في الصلاة، قال تعالى: {وَأَقِمِ الصَّلاَةَ طَرَفَيِ النَّهَارِ وَزُلَفاً مِّنَ اللَّيْلِ إِنَّ الْحَسَنَاتِ يُذْهِبْنَ السَّـيِّئَاتِ ذَلِكَ ذِكْرَى لِلذَّاكِرِينَ} [سورة هود: 114]، قال العلماء:     'تواردت الأخبار أنها الصلوات الخمسة، وأنها مكفرة للسيئات'.,post,2014-11-08 18:48:19,349,
ومن ثمرات الصلاة أنها من أعظم الأسباب في رفع الدرجات: قال صلى الله عليه وسلم: «فإنك لا تسجد لله سجدة إلا رفعك الله بها درجة» [رواه مسلم]، ويؤيد هذا قوله صلى الله عليه وسلم لربيعه لمَّا طلب مرافقته في الجنة: «أعني على نفسك بكثرة السجود» [رواه النسائي وصححه الألباني].,post,2014-11-08 18:48:19,350,
ومن ثمرات الصلاة أنها منشطة للجوارح والنفوس، فهي أعظم مولد للنشاط اليومي، فكيف لا وهي صلة بين الخالق والمخلوق خمس مرات في اليوم والليلة، ولهذا يقول صلى الله عليه وسلم: «وجعلت قرة عيني في الصلاة» [رواه النسائي وصححه الألباني] وقوله صلى الله عليه وسلم: «يا بلال أقم الصلاة، أرحنا بها» [صححه الألباني].,post,2014-11-08 18:48:19,351,
ومن ثمرات الصلاة أنها منهاة عن الإثم: قال تعالى: {إِنَّ الصَّلَاةَ تَنْهَى عَنِ الْفَحْشَاء وَالْمُنكَرِ} [سورة العنكبوت: 45]، وفي المقابل فكل فحشاء ومنكر يصد عن ذكر الله وعن الصلاة.,post,2014-11-08 18:48:19,352,
أنّ المحافظة علي الصلاة سبب لقبول سائر الأعمال.,post,2014-11-08 18:48:20,353,
الصلاة  منشطة للجوارح.,post,2014-11-08 18:48:20,354,
الصلاة  منورة للقلب، مبيّضة للوجه.,post,2014-11-08 18:48:20,355,
الصلاة جالبة للرزق.,post,2014-11-08 18:48:20,356,
الصلاة قرة للعين.,post,2014-11-08 18:48:20,357,
الصلاة- داحضة للظلم.,post,2014-11-08 18:48:20,358,
الصلاة- قامعة للشهوات.,post,2014-11-08 18:48:20,359,
المحافظة علي الصلاة سلامة من الاتصاف بصفات المنافقين.,post,2014-11-08 18:48:20,360,
المحافظة علي الصلاة سلامة من الحشر مع فرعون وقارون وهامان وأُبي بن خلف.,post,2014-11-08 18:48:20,361,
وكان النبي صلى الله عليه وسلم في مسند أحمد إذا حزبه أمر فزع إليها، وكذلك الأمر عند حصول الكوارث والمصائب، وعند حصول الكسوف والخسوف، فإنه يفزع إليها.,post,2014-11-08 18:48:20,362,
ومن ثمرات الصلاة  الانزجار عن الفحشاء والمنكر.,post,2014-11-08 18:48:20,363,
ومن ثمرات الصلاة  تفريح القلب، مبيضة للوجه.,post,2014-11-08 18:48:20,364,
ومن ثمرات الصلاة أن الله أمر عباده بالفزع إليها والاستعانة بها على مصالح الدنيا، ولم يخص الاستعانة بشيء غيرها، لأنها أكبر عون على مصالح الدنيا والآخرة، ودفع مفاسدها، قال تعالى: {يَا أَيُّهَا الَّذِينَ آمَنُواْ اسْتَعِينُواْ بِالصَّبْرِ وَالصَّلاَةِ إِنَّ اللّهَ مَعَ الصَّابِرِينَ} [سورة البقرة: 153],post,2014-11-08 18:48:20,365,
ومن ثمرات الصلاة أن الله عظم أجرها، وأمر بها من قبلنا وأمرنا بها، فهي خمس صلوات مفروضه، وخمسون في الثواب، قال الله تعالى في حديث الإسراء : «هِيَ خَمْسٌ وَهْىَ خَمْسُونَ لاَ يُبَدَّلُ الْقَوْلُ لَدَىَّ» [رواه مسلم].,post,2014-11-08 18:48:20,366,
ومن ثمرات الصلاة أنها ثورث ذكر الله تعالى: {وَأَقِمِ الصَّلَاةَ لِذِكْرِي} [سورة طه: 14]، وقال: {وَلَذِكْرُ اللَّهِ أَكْبَرُ} [سورة العنكبوت: 45]، أفلا يحب العبد ما يُذكر به عند ربه؟ ولم يكن في الصلاة فضيلة وشرف وفضل إلا أن يُذكر صاحبها لكفى بها فضيلة، قال تعالى في الحديث القدسي: «فَإِنْ ذَكَرَنِي فِي نَفْسِهِ ذَكَرْتُهُ فِي نَفْسِي» [رواه مسلم].,post,2014-11-08 18:48:20,367,
ومن ثمرات الصلاة أنها رافعة لأمراض القلوب، فلم يبرئ الله أحداً من خلقه من هذه الأمراض، وهي الجزع عند المصائب، والمنع عند حصول الخير إلا المصلين خاصة: قال تعالى: {إِنَّ الْإِنسَانَ خُلِقَ هَلُوعاً (19) إِذَا مَسَّهُ الشَّرُّ جَزُوعاً (20) وَإِذَا مَسَّهُ الْخَيْرُ مَنُوعاً (21) إِلَّا الْمُصَلِّينَ} [سورة المعارج: 19-22]، فهي أمراض رافعة لأمراض القلوب.,post,2014-11-08 18:48:20,368,
ومن ثمرات الصلاة أنها غذاء للأرواح والقلوب، فإنها بحاجة ماسة إلى نزول الرحمات، فكما أن الجسد بحاجة إلى الغذاء، فكذلك الروح، فمعلوم أن كلاً منهما هضم غذاءه فيحتاج دوماً إلى تجديد الغذاء، فجعل الله الصلوات الخمس غذاء للأرواح مقسمة على اليوم والليلة.,post,2014-11-08 18:48:20,369,
ومن ثمرات الصلاة أنها مجلبة للأرزاق، فإذا العبد الصلاة وحافظ عليها، رزقه الله من حيث لا يحتسب، قال تعالى: {وَأْمُرْ أَهْلَكَ بِالصَّلَاةِ وَاصْطَبِرْ عَلَيْهَا لَا نَسْأَلُكَ رِزْقاً نَّحْنُ نَرْزُقُكَ وَالْعَاقِبَةُ لِلتَّقْوَى} [سورة طه: 132]، فالصلاة مفتاح يُستفتح بها أبواب الرزق.,post,2014-11-08 18:48:20,370,
ومن ثمرات الصلاة خصوصا صلاة الصبح، إذا صلاها في جماعة، كان في أمان الله وعهده وحفظه، فلا تضره فتنة؛ لأن الصلاة تنهى عن الفحشاء والمنكر، قال صلى الله عليه وسلم: «من صلى صلاة الصبح فهو في ذمة الله، فلا يطلبنكم الله من ذمته بشيء» [رواه مسلم]، فمن تركها أصبح مطالباً بأداء الذمة والعهد الملتزم به أمام لله.,post,2014-11-08 18:48:20,371,
الصلاة  المدد الروحي الذي لا ينقطع، والزاد المعنوي الذي لا ينضب.,post,2014-11-08 18:48:21,372,
الصلاة  دافعة لأدواء القلوب من الشهوات والشبهات.,post,2014-11-08 18:48:21,373,
الصلاة  سبب لتكفير السيئات، ورفع الدرجات، وزيادة الحسنات، والقرب من رب الأرض والسموات.,post,2014-11-08 18:48:21,374,
الصلاة  سبب لحسن الخلق، وطلاقة الوجه، وطيب النفس.,post,2014-11-08 18:48:21,375,
الصلاة  سبب لعلو الهمة، وسمو النفس وترفعها عن الدنايا.,post,2014-11-08 18:48:21,376,
الصلاة أعظم غذاء وسقي لشجرة الإيمان، فالصلاة تثبت الإيمان وتنميه.,post,2014-11-08 18:48:21,377,
الصلاة سبب لاستسهال الصعاب، وتحمل المشاق؛ فحينما تتأزم الأمور وتضيق؛ وتبلغ القلوب الحناجر ـ يجد الصادقون قيمة الصلاة الخاشعة؛ وحسن تأثيرها وبركة نتائجها.,post,2014-11-08 18:48:21,378,
الصلاة- حافظة للنعم، دافعة للنقم.,post,2014-11-08 18:48:21,379,
الصلاة- منزلة للرحمة، كاشفة للغمة.,post,2014-11-08 18:48:21,380,
المحافظة علي الصلاة تقوي رغبة الإنسان في فعل الخيرات، وتُسهّل عليه فعل الطاعات، وتذهب ـ أو تضعف ـ دواعي الشر والمعاصي في نفسه، وهذا أمر مشاهد محسوس؛ فإنّك لا تجد محافظًا على الصلاة ـ فروضها ونوافلها ـ إلاّ وجدت تأثير ذلك في بقية أعماله.,post,2014-11-08 18:48:21,381,
ما استُجلبت مصالح الدنيا والآخرة بمثل الصلاة؛ لأنّها صلة بين العبد وربّه، وعلى قدر صلة العبد بربّه تنفتح له الخيرات، وتنقطع ـ أو تقل ـ عنه الشرور والآفات، وما ابتلي رجلان بعاهة أو مصيبة أو مرض واحد إلاّ كان حظ المصلي منها أقل وعاقبته أسلم.,post,2014-11-08 18:48:21,382,
والصلاة علاج لأدواء النفس الكثيرة، كالبخل، والشح، والحسد، والهلع، والجزع، وغيرها.,post,2014-11-08 18:48:21,383,
وللصلاة تأثير عجيب في دفع شرور الدنيا والآخرة، لا سيما إذا أُعطيت حقها من التكميل ظاهرًا وباطنًا، فما استُدفعت شرور الدنيا والآخرة بمثل الصلاة,post,2014-11-08 18:48:21,384,
ومن ثمرات الصلاة  إظهار شعائر الإسلام والدعوة إليه بالقول والعمل.,post,2014-11-08 18:48:21,385,
ومن ثمرات الصلاة  تشجيع المتخلف.,post,2014-11-08 18:48:21,386,
ومن ثمرات الصلاة التعارف بين المسلمين.,post,2014-11-08 18:48:21,387,
ومن ثمرات الصلاة التعاون على البر والتقوى، والتواصي بالحق والتواصي بالصبر.,post,2014-11-08 18:48:21,388,
ومن ثمرات الصلاة- حصول المودة بين المسلمين؛ فالقرب في الأبدان مدعاة للقرب في القلوب.,post,2014-11-08 18:48:21,389,
ومن فوائد الصلاة: أنّها تُوقد نار الغيرة في قلب المؤمن على حُرمات الله.,post,2014-11-08 18:48:21,390,
ومن فوائد الصلاة: الثبات على الفتن؛ فالمحافظون علي الصلاة أثبت النّاس عند الفتن.,post,2014-11-08 18:48:21,391,
أبرار الصلاة:    قال أبو بكر بن عياش: 'لو رأيت منصور بن المعتمر، وربيع بن أبي راشد، وعاصم بن أبي النجود في الصلاة، قد وضعوا لحاهم على صدورهم، عرفت أنهم من أبرار الصلاة'.,post,2014-11-08 18:48:22,392,
إنه الفاروق:    وهذا الفاروق عمر بن الخطاب رضي الله عنه، لما طعنه المجوسي أبو لؤلؤة وهو يصلي بالناس غلبه النزف حتى غُشي عليه، فأدخلوه بيته، فلم يزل في غشية حتى أسفر، فنظر في وجوه من حوله فقال:     'صلّى الناس؟' قالوا: 'نعم'، فقال: 'لا إسلام لمن ترك الصلاة'، ثم توضأ وصلّى وجرحه ينزف دمًا.,post,2014-11-08 18:48:22,393,
اقطعوها وأنا في الصلاة:    لما وقعت الأكلة في رجل عروة بن الزبير احتاج الأطباء إلى قطعها حتى لا ينتشر المرض في بقية جسده، فقالوا له:     'ألا نسقيك مُرقداً حتى يذهب عقلك منه فلا تحسُّ بألم النشر؟' فقال: 'لا والله، ولكن إن كنتم لابد فاعلين فاقطعوها وأنا في الصلاة، فإني لا أحسُّ بذلك، ولا أشعر به'، فقام الأطباء بقطع رجله وهو يصلي فما تضوّر ولا صاح ولا اختلج.,post,2014-11-08 18:48:22,394,
تذكر النار:    قال أبو عبدالرحمن الأسدي: قلت لسعيد بن عبدالعزيز: 'يا أبا محمد، ما هذا البكاء الذي يعرض لك في صلاتك؟'    قال: 'يا ابن أخي، وما سؤالك عن ذلك؟'    قلت: 'يا عمّ، لعل الله أن ينفعني'.    قال سعيد: 'ما قمت في صلاتي إلا مثلت لي جهنم'.,post,2014-11-08 18:48:22,395,
تنبيه:    كان عمر رضي الله عنه إذا رأى أحداً يطاطئ عنقه في الصلاة يضربه بالدرة، ويقول له:     'ويحك، إنما الخشوع في القلب'.,post,2014-11-08 18:48:22,396,
حيلة شيطانية:    عن الحارث بن قيس قال: 'إذا أتاك الشيطان وأنت تصلي فقال: 'إنك مراءٍ'، فزدها طولاً'.,post,2014-11-08 18:48:22,397,
خشوع ابن الزبير:    وكان ابن الزبير إذا قام في الصلاة فكأنه عود من الخشوع، وكان يسجد فتنزل العصافير على ظهره، لا تحسبه إلا جذعاً أو حائطاً أو خشبة منصوبة لا تتحرك.,post,2014-11-08 18:48:22,398,
خشوع الصديق:    وكان أبو بكر رضي الله عنه يبكي في الصلاة حتى لا يسمع الناس قراءته، ولمّا مرض النبي صلى الله عليه وسلم مرضه الذي مات فيه قال: «مروا أبا بكر فليصلِّ بالناس» قالت عائشة رضي الله عنها:     'إن أبا بكرٍ رجل رقيق، إذا قرأ القرآن لا يملك دمعه'.,post,2014-11-08 18:48:22,399,
خشوع المعلى بن منصور:    كان المعلى بن منصور يوماً يصلي، فوقع على رأسه كورُ الزنابير فما التفت، وما انفتل حتى أتم صلاته، فنظروا فإذا قد صار هكذا من شدة الانتفاخ.,post,2014-11-08 18:48:22,400,
خشوع علي بن الحسين:    وكان علي بن الحسين إذا فرغ من وضوئه للصلاة، وصار بين وضوئه وصلاته، أخذته رعدةٌ ونفضةٌ، فقيل له في ذلك، فقال:     'ويحكم، أتدرون إلى من أقوم ومن أريد أن أناجي؟'.,post,2014-11-08 18:48:22,401,
خشوع مسلم بن يسار:    وكان مسلم بن يسار لا يلتفت في صلاته، ولقد انهدمت ناحية من المسجد ففزع لها أهل السوق فما التفت.    وكان إذا دخل منزله سكت أهل بيه، فإذا قام يصلي تكلموا، أو ضحكوا، علماً منهم بأن قلبه مشغول عنهم، وكان يقول:     'إلهي، متى ألقاك وأنت راضٍ'.,post,2014-11-08 18:48:22,402,
فإنّ الله -تبارك وتعالى- جعل للصّلاة منزلةً عاليةً، فهي الرّكن الثّاني من أركان الإسلام كما جاء عن ابن عمر -رضي الله عنهما- قال: قال رسول الله -صلى الله عليه وسلم-: «شهادة أن لا إله إلا الله وأنّ محمّدًا رسول الله، وإقام الصّلاة، وإيتاء الزّكاة، والحجّ، وصوم رمضان» [رواه البخاري 8 ومسلم 16].,post,2014-11-08 18:48:22,403,
من أسباب الخشوع في الصلاة:    عن ابن عمر رضي الله عنهما: في قوله تعالى: {الَّذِينَ هُمْ فِي صَلَاتِهِمْ خَاشِعُونَ} [المؤمنون: 2] قال:     'كانوا إذا قاموا في الصلاة أقبلوا على صلاتهم، وخفضوا أبصارهم إلى موضع سجودهم، وعلموا أن الله يُقبل عليهم، فلا يلتفتون يميناً ولا شمالاً'.,post,2014-11-08 18:48:22,404,
والصّلاة متى ما صلحت صلح سائر العمل، ومتى ما فسدت فسد سائر العمل كما قال -صلّى الله عليه وسلم-: «إن أول ما يحاسب به العبد يوم القيامة من عمله صلاته، فإن صلحت فقد أفلح وأنجح، وإن فسدت فقد خاب وخسر، فإن انتقص من فريضة شيئًا، قال الرّبّ -تبارك وتعالى-: انظروا هل لعبدي من تطوعٍ فيكمل بها ما انتقص من الفريضة، ثم يكون سائر عمله على ذلك» [رواه التّرمذي 413 وصححه الألباني].,post,2014-11-08 18:48:22,405,
وقال الفضيل بن عياض: 'كان يُكره أن يُرى الرجل من الخشوع أكثر مما في قلبه'.,post,2014-11-08 18:48:22,406,
ولأهميتها، ولعظم قدرها، وسموها مكانتها، فرضت على رسول الله -صلّى الله عليه وسلم- وعلى أمّته في السّماء السّابعة، ليلة الإسراء والمعراج، فعن أنس بن مالك-رضي الله عنه- قال: «فرضت على النّبيّ -صلّى الله عليه وسلم- ليلة أسري به الصّلوات خمسين، ثمّ نقصت حتى جعلت خمسًا، ثم نودي: يا محمد: إنّه لا يبدل القول لدي، وإن لك بهذه الخمس خمسين» [رواه التّرمذي 213 وصححه الألباني].,post,2014-11-08 18:48:22,407,
ومن فوائد الصلاة  أنّها نافعة في كثير من أوجاع البطن؛ لأنّها رياضة للنفس والبدن معًا، فهي تشمل على حركات وأوضاع مختلفة تتحرك معها أغلب المفاصل، وينغمز معها أكثر الأعضاء الباطنة، كالمعدة، وسائر آلات النفس والغذاء، أضف إلى ذلك الطهارة المتكررة وما فيها من نفع، كل ذلك نفعه محسوس مشاهد لا يماري فيه إلاّ جاهل.,post,2014-11-08 18:48:22,408,
ومن فوائد الصلاة  ومن ذلك: ما أظهره الطب الحديث من فوائد عظيمة للصلاة، الصلاة  أنّ الدماغ ينتفع انتفاعًا كبيرًا بالصلاة ذات الخشوع، كما قرر ذلك كبار الأطباء في هذا العصر، وهذا دليل من الأدلة التي يتبين لنا بها سبب قوة تفكير الصحابة الكرام، وسلامة عقولهم، ونفاذ بصيرتهم، وقوة جنانهم، وصلابة عودهم.,post,2014-11-08 18:48:22,409,
ومن فوائد الصلاة الصحية: أنّها ـ كما مرّ ـ تنير القلب وتشرح الصدر، وتفرح النفس والروح، ومعلوم عند جميع الأطباء أنّ السعي في راحة القلب وسكونه وفرحه وزوال همّه وغمه، من أكبر الأسباب الالبة للصحة، الدافعة للأمراض، المخففة للآلام، وذلك مجرب مشاهد محسوس في الصلاة خصوصًا صلاة الليل وأوقات الأسحار.,post,2014-11-08 18:48:22,410,
ومن فوائد الصلاة الطبية: ما فيها من الرياضة المتنوعة، المقوية للأعضاء، النافعة للبدن.,post,2014-11-08 18:48:22,411,
إن الشّارع الكريم كما ضاعف الأجر والثواب لمن أدّى صلاة الفريضة في جماعة، كذلك ضاعف العقوبة على من تهاون في أداء صلاة الفريضة في جماعة، فهي الفارقة بين الكفر والإيمان، كما قال رسول الله -صلّى الله عليه وسلم-: «العهد الّذي بيننا وبينهم الصّلاة فمن تركها فقد كفر» [رواه ابن ماجه 891 والتّرمذي 2621 وصححه الألباني]،,post,2014-11-08 18:48:24,412,
قال الإمام ابن القيم -رحمه الله-: 'لا يختلف المسلمون أن ترك الصّلاة المفروضة عمدًا من أعظم الذّنوب وأكبر الكبائر، وأن إثمه أعظم من إثم قتل النّفس وأخذ الأموال ومن إثم الزّنا والسّرقة وشرب الخمر وأنّه معرضٌ لعقوبة الله وسخطه وخزيه في الدّنيا والآخرة' (الصّلاة وحكم تاركها (16)).,post,2014-11-08 18:48:24,413,
للخشوع في الصلاة ...أحرص على     - الطمأنينة في الصلاة: كان النبي صلى الله عليه وسلم يطمئن حتى يرجع كل عظم إلى موضعه.,post,2014-11-08 18:48:24,414,
للخشوع في الصلاة ...أحرص على     أن يُقطع قراءته آية آية: وذلك أدعى للفهم والتدبر، وهي سنة النبي صلى الله عليه وسلم.,post,2014-11-08 18:48:24,415,
للخشوع في الصلاة ...أحرص على     الاستعداد للصلاة والتهيؤ لها: وهذا يحصل، بالترديد مع المؤذن، والإتيان بالدعاء المشروع، بعده والدعاء بين الأذان الاقامة، كذلك الاستعداد بستر العورة ،وطهارة البقعة، والتبكير، والمشي إلى المسجد بسكينة ووقار(للرجل)، وعدم التشبيك بين الأصابع، وانتظار الصلاة وكذلك تسوية الصفوف والتراص فيها.,post,2014-11-08 18:48:24,416,
للخشوع في الصلاة ...أحرص على     تذكر الموت في الصلاة: لقوله صلى الله عليه وسلم: «اذكر الموت في صلاتك، فإن الرجل إذا ذكر الموت في صلاته لحري أن يحسن صلاته، وصل صلاة رجل لا يظن أنه يصلي غيرها».,post,2014-11-08 18:48:24,417,
للخشوع في الصلاة ...أحرص على     ترتيل القرآن وتحسين الصوت به: لقوله صلي الله عليه وسلم: «زينوا القرآن بأصواتكم، فإن الصوت الحسن يزيد القرآن حسنا».,post,2014-11-08 18:48:24,418,
